{
  "framework": "Compound Design",
  "release": "0.3.0-alpha.1",
  "releaseTheme": "Work System",
  "releaseStage": "candidate",
  "pluginVersion": "0.3.0-alpha.1",
  "updatedAt": "2026-09-09",
  "evidencePolicy": {
    "currentLevel": "E1",
    "runtimeUplift": "not measured",
    "rule": "CDQI measures construction quality. CEL measures evidence maturity. They must never be merged into one claim.",
    "stableEvidenceBaseline": "0.2.1",
    "versionRule": "Plugin version and evidence level are independent. A candidate release may ship new resources at E0; a resource reaches E1 only by passing its deterministic contract suite, and nothing in this release exceeds E1."
  },
  "resources": [
    {
      "id": "cd-frame",
      "publicName": "Frame",
      "kind": "skill",
      "status": "active",
      "path": "skills/cd-frame/SKILL.md",
      "version": "0.3.0-alpha.1",
      "job": "Establish the problem, user, outcome, constraints, non-goals, risks and success conditions before anything is designed.",
      "triggers": [
        "work whose problem statement is still moving",
        "a request that arrived as a solution",
        "start of multi-stage work"
      ],
      "nonGoals": [
        "designing the solution",
        "writing implementation plans",
        "product strategy"
      ],
      "upstream": [
        "Compound Design authored resource",
        "Every Compound Engineering (mechanisms, MIT)"
      ],
      "provenance": "composed-and-authored, upstream-informed",
      "cdqi": null,
      "cel": "E0",
      "runtimeUplift": "not measured",
      "evidenceDebt": [
        "deterministic contract suite",
        "runtime behaviour in real work",
        "routing accuracy",
        "effect on outcomes"
      ]
    },
    {
      "id": "cd-model",
      "publicName": "Model",
      "kind": "skill",
      "status": "active",
      "path": "skills/cd-model/SKILL.md",
      "version": "0.3.0-alpha.1",
      "job": "Decide how the product must behave: entities, routes, states, transitions, edge cases and the contract Build implements.",
      "triggers": [
        "behaviour must be decided before code",
        "more than one screen, role or state",
        "agentic or AI-mediated feature"
      ],
      "nonGoals": [
        "problem definition",
        "implementation",
        "visual craft",
        "evidence policy"
      ],
      "upstream": [
        "Compound Design authored resource"
      ],
      "provenance": "authored",
      "cdqi": null,
      "cel": "E0",
      "runtimeUplift": "not measured",
      "evidenceDebt": [
        "deterministic contract suite",
        "runtime behaviour in real work",
        "routing accuracy",
        "effect on outcomes"
      ]
    },
    {
      "id": "cd-build",
      "publicName": "Build",
      "kind": "skill",
      "status": "active",
      "path": "skills/cd-build/SKILL.md",
      "version": "0.3.0-alpha.1",
      "job": "Implement a decided contract inside the existing architecture, verify locally, and report exactly what changed.",
      "triggers": [
        "a behaviour contract needs implementing",
        "a small local change with obvious behaviour"
      ],
      "nonGoals": [
        "deciding behaviour",
        "publishing or merging",
        "absorbing work it did not create"
      ],
      "upstream": [
        "Compound Design authored resource",
        "Every Compound Engineering (mechanisms, MIT)"
      ],
      "provenance": "composed-and-authored, upstream-informed",
      "cdqi": null,
      "cel": "E0",
      "runtimeUplift": "not measured",
      "evidenceDebt": [
        "deterministic contract suite",
        "runtime behaviour in real work",
        "routing accuracy",
        "effect on outcomes"
      ]
    },
    {
      "id": "cd-verify",
      "publicName": "Verify",
      "kind": "skill",
      "status": "active",
      "path": "skills/cd-verify/SKILL.md",
      "version": "0.3.0-alpha.1",
      "job": "Check the built result against what was decided: requirements, behaviour, states, accessibility and responsiveness.",
      "triggers": [
        "after Build and before shipping",
        "behaviour of existing work is in doubt",
        "a claim needs checking"
      ],
      "nonGoals": [
        "deciding what should have been built",
        "implementing fixes under report-only",
        "resource evidence decisions"
      ],
      "upstream": [
        "Compound Design authored resource",
        "Every Compound Engineering (mechanisms, MIT)"
      ],
      "provenance": "composed-and-authored, upstream-informed",
      "cdqi": null,
      "cel": "E0",
      "runtimeUplift": "not measured",
      "evidenceDebt": [
        "deterministic contract suite",
        "runtime behaviour in real work",
        "routing accuracy",
        "effect on outcomes"
      ]
    },
    {
      "id": "cd-polish",
      "publicName": "Polish",
      "kind": "skill",
      "status": "active",
      "path": "skills/cd-polish/SKILL.md",
      "version": "0.3.0-alpha.1",
      "job": "Make a working interface deliberate: hierarchy, typography, spacing, colour, copy, feel and consistency.",
      "triggers": [
        "behaviour is correct and the result feels unconsidered",
        "before showing work to users",
        "a surface has drifted"
      ],
      "nonGoals": [
        "repairing broken behaviour",
        "redesign",
        "changing logic or data"
      ],
      "upstream": [
        "Compound Design authored resource"
      ],
      "provenance": "authored",
      "cdqi": null,
      "cel": "E0",
      "runtimeUplift": "not measured",
      "evidenceDebt": [
        "deterministic contract suite",
        "runtime behaviour in real work",
        "routing accuracy",
        "effect on outcomes"
      ]
    },
    {
      "id": "cd-compound",
      "publicName": "Compound",
      "kind": "skill",
      "status": "active",
      "path": "skills/cd-compound/SKILL.md",
      "version": "0.3.0-alpha.1",
      "job": "Capture the one learning a future person or agent would otherwise rediscover, and make it discoverable.",
      "triggers": [
        "work produced a non-obvious correction or mechanism",
        "a reproduced failure",
        "a human correction that will recur"
      ],
      "nonGoals": [
        "documenting work that taught nothing",
        "maintaining the store over time",
        "performing a promotion"
      ],
      "upstream": [
        "Compound Design authored resource",
        "Every Compound Engineering (mechanisms, MIT)"
      ],
      "provenance": "composed-and-authored, upstream-informed",
      "cdqi": null,
      "cel": "E0",
      "runtimeUplift": "not measured",
      "evidenceDebt": [
        "deterministic contract suite",
        "runtime behaviour in real work",
        "routing accuracy",
        "effect on outcomes"
      ]
    },
    {
      "id": "cd-strategy",
      "publicName": "Strategy",
      "kind": "skill",
      "status": "active",
      "path": "skills/cd-strategy/SKILL.md",
      "version": "0.3.0-alpha.1",
      "job": "Create and maintain the project anchor stating what the product is, who it serves and how it succeeds.",
      "triggers": [
        "no anchor exists and Frame keeps re-litigating direction",
        "direction changed",
        "a section is stale"
      ],
      "nonGoals": [
        "feature planning",
        "prioritisation",
        "implementation decisions"
      ],
      "upstream": [
        "Compound Design authored resource",
        "Every Compound Engineering (mechanisms, MIT)"
      ],
      "provenance": "composed-and-authored, upstream-informed",
      "cdqi": null,
      "cel": "E0",
      "runtimeUplift": "not measured",
      "evidenceDebt": [
        "deterministic contract suite",
        "runtime behaviour in real work",
        "routing accuracy",
        "effect on outcomes"
      ]
    },
    {
      "id": "cd-compound-refresh",
      "publicName": "Compound Refresh",
      "kind": "skill",
      "status": "active",
      "path": "skills/cd-compound-refresh/SKILL.md",
      "version": "0.3.0-alpha.1",
      "job": "Audit the durable learning store against the codebase and apply one outcome per document, including deletion.",
      "triggers": [
        "the store has grown and is not trusted",
        "the codebase moved",
        "discovery returns noise or nothing"
      ],
      "nonGoals": [
        "capturing new learnings",
        "changing product code",
        "editing the guidance layer it audits"
      ],
      "upstream": [
        "Compound Design authored resource",
        "Every Compound Engineering (mechanisms, MIT)"
      ],
      "provenance": "composed-and-authored, upstream-informed",
      "cdqi": null,
      "cel": "E0",
      "runtimeUplift": "not measured",
      "evidenceDebt": [
        "deterministic contract suite",
        "runtime behaviour in real work",
        "routing accuracy",
        "effect on outcomes"
      ]
    },
    {
      "id": "cd-setup",
      "publicName": "Setup",
      "kind": "skill",
      "status": "active",
      "path": "skills/cd-setup/SKILL.md",
      "version": "0.3.0-alpha.1",
      "job": "Diagnose whether Compound Design can run in a repository and offer to create or repair its repo-local configuration.",
      "triggers": [
        "after installing or upgrading the plugin",
        "a skill reports missing configuration",
        "before anything that writes"
      ],
      "nonGoals": [
        "installing tools",
        "editing an existing valid config",
        "touching global host configuration"
      ],
      "upstream": [
        "Compound Design authored resource",
        "Every Compound Engineering (mechanisms, MIT)"
      ],
      "provenance": "composed-and-authored, upstream-informed",
      "cdqi": null,
      "cel": "E0",
      "runtimeUplift": "not measured",
      "evidenceDebt": [
        "deterministic contract suite",